,new_title,new_description,new_link,new_price,new_ship_price,new_ship_how
0,Magneto Bamboo Cruiser Longboard," KICKTAIL CRUISER Longboard Cruise in Style The Kicktail Cruiser is inspired by the vibrant Carlsbad surf and skating community. The design really shows off the beautiful materials of the deck while keeping a clean and stylish look. Style is the name of the game with this longboard. Great for Beginners The Kicktail Cruiser is a great option for beginners and pros alike! The deck is nice and stable without much flexibility making it easy and safe to ride. The wheels are nice and soft for extra grip while turning and a super smooth ride over rougher roads. Whether this is your first board or another added to your quiver, you'll get a lot of joy out of this board. High Quality Materials and Components We used our typical high quality components to build out this board because beginners deserve great components just like advanced riders require. No compromises were made in the design of the Kicktail Cruiser. Aluminum Trucks The trucks are made from gravity cast aluminum which makes them strong and durable. They have a tumbled finish and are the standard longboard size. Bamboo Maple Deck The deck is made with bamboo veneer on top and bottom with a maple core to add strength and stiffness. Our logo is laser etched directly into the bamboo. Soft Urethane Wheels A 78A soft urethane is used for the 70mm wheels. With a cool translucent look, the wheels are sized perfectly for the cruising this board excels at.",https://www.ebay.com/itm/Magneto-Bamboo-Cruiser-Longboard/193624501870?var=493840233073?,79.99, FREE ,"Carlsbad, California, United States"
1,17 Key Kalimba Thumb Piano High-Quality Wood Body Sanza Mbira Musical Instrument,"Kalimba Cosmetic Tools Makeup Brush Lipstick Brush Cleaner Beauty & Personal Care Facial Brush Hair Brush Pedicure/Manicure Tools Foot Care Nail Care Daily Use Kitchenware Bathroom Ware Consumer Electronics Smart Watch 3D Printing Pen CPU Fans Other 17 Key Kalimba Thumb Piano High-Quality Wood Body Sanza Mbira Musical Instrument Product Description 17 Keys Kalimba Solid Wood Material Thumb Finger Hand Piano Sanza Mbira Likembe 17 Keys Kalimba Thumb Piano High-Quality Wood Mahogany Body Musical Instrument 100% Brand New & High Quality M aterial:W ood,Metal Color:As see the pictures. Applicable People:Beginner,High-end Positioning,Home Education Package Included: 1 x 17 Keys Kalimba Custom name and design processes service available , Please do not feel hesitate to ask.( Need Pay extra c h a r g e and need wait 1-2 weeks ). For any updates inquires, like wood parts, hardware and inlay. ..Please contact us for more details. We provide wholesale program. Price is open for discussion. Description: The kalimba is an African musical instrument consisting of a wooden board (often collated with aresonator) with attached staggered metal tines, playing by holding the instrument in the hands and plucking the tines with the thumbs. Just need to use two thumbs to make a sound. The kalimba is classified as part of thelamellaphonefamily, and part of theidiophonefamily of musical instruments. Features: - Perfect for Beginners and Children Easy to use, simply pluck the kalimba tines to play, and practice your finger flexibility and coordination. Easy to learn and easy to explore and cultivate your musical talent. - Made of High-quality Wood A beautiful warm solidwood body creates comforting warm sound as only natural products can make. -Super Craftsmanship Our thumb piano keys are accurately tuned length of steel which delivers clear, crisp sound and tones. Fine workmanship will bring you beautiful music. - Security Protection Kalimba box can effectively protect kalimba regardless of performance or collection, preventing moisture, oxidation, scratches, falling, and very easy to carry. - Small Kalimba Music Instrument It is favored because of its compact size and simplicity. Our kalimba is lightweight and portable so you can make music anywhere anytime. - 17 Steel Keys and 2 Vibrato Holes The metal keys are mounted on a wooden box that acts as the resonating chamber. As you play you can uncover and cover the vibrato holes as you like to create personalized tones. Note :Light shooting and different displays may cause the color of the item in the picture a little different from the real thing. The measurement allowed error is +/- 1-2cm. Payment Policy Shipping Policy Terms of Sale Return Policy Customer Service Payment Policy We accept PayPal only. We only ship item to your PayPal verified address. Please make payment asap, then we can arrange shipment for you asap. Shipping Policy Item will be sent within 24-48 hours of payment verification. Delivery time depends on the destination country and customs. TO USA          about 10-20 working days TO UK           about 15-25 working days TO AU           about 15-30 working days TO Canada        about 20-35 working days TO France        about 20-35 working days TO Germany       about 20-35 working days TO Russian        about 25-40 working days South American     about 25-40 working days Terms of Sale Our listing price includes the value of goods, packaging cost, and export taxes, not including international import duties. Import duties, taxes, and charges are not included in the item price or shipping fee. The import duties are buyer's responsibility. Please check with your country's customs office determine what these additional costs will be prior to your purchase. All disputes arising from the import duties will be submitted to  for solution. Return Policy You may return your item in the original packaging & condition for a refund within 14 days since you receive the item. Please contact us before sending back the item to us. Buyer will be responsible for return postage. Should you have any question, please send message to our  account. Customer Service Our working time: Beijing time: Monday to Friday 9:00 am to 5:00 pm. Any questions, please contact us via  message, We will reply within 48 hours in our working hours. If you are satisfied with our service, please kindly leave us a positive feedback and give us the Detailed Seller Rating with all ""5 stars"" in very area. Our aim is to provide Top Level Customer Service, your recognition will encourage us greatly and serve you better. We strive to keep all our customers satisfy. We greatly appreciate your POSITIVE feedback. Please do NOT leave negative feedback without asking for help. Thanks! Copyright Â© 2018 Dianxiaomi",https://www.ebay.com/itm/17-Key-Kalimba-Thumb-Piano-High-Quality-Wood-Body-Sanza-Mbira-Musical-Instrument/254673187917?,24.99, FREE ,"Walnut, California, United States"
2,Best Friend Gifts For Bestie Gift For Bff Mug Galentines Day Gifts Best Friend," Product Details. This high quality 11oz & 15oz. ceramic white mug has a premium hard coat that provides crisp and vibrant color reproduction sure to last for years. Perfect for all hot & cold beverages. The highest quality printing possible is used. It will never fade no matter how many times you wash it. Material: 100% Ceramic. Printboth sides. Dishwasher and Microwave Safe. High Gloss + Premium White Finish. Printed in the U.S.A. Personalized & Custom. We support personalized and custom mug to add custom, when placing an order, you can add notes to the “order note” in shipping address section. Also you can contact us directly via message. Shipping Info. Ready to ship in 1–2 business days, All products are made-to-order and proudly printed in the United States. Shipped by USPS and DHL, You will receive your order in 5-7 days. Replace & Refund. All products are defective during shipping broken , chipped will be replaced free of charge. You are not satisfied with the product, we will refund 100% money to you. If any other issues arise, please do not hesitate to contact us– we would be more than happy to assist you.",https://www.ebay.com/itm/Best-Friend-Gifts-For-Bestie-Gift-For-Bff-Mug-Galentines-Day-Gifts-Best-Friend/383346175175?var=651811952477?,12.99/ea, FREE ,"Waldorf, Maryland, United States"
3,KKMOON 16CH 5MP Lite H.265+ DVR 720P Outdoor Security Camera System Night Vision," Note: This DVR kit is shipped with no hard disk, so you may need buy and install it yourself, and it has SATA3.0 cable inside, so you can easily connect and install the hard disk. Hard Disk Required: 3.5inch SATA port, 500G-3TB capacity. Note: This camera is only suitable to use in America, Canada and Japan. Note: If you need download the software or more detailed information, you can download it by the link on the user manual. Features: *Consist of 16CH 1080P H-ybrid NVR AHD TVI CVI DVR 5-in-1 Digital Video Recorder + 16*1500TVL 720P AHD waterproof infrared camera + 16*60ft cable for CCTV security system *NVR CVI TVI HVR AHD 5-in-1 function, support both AHD camera and analog camera input.(Support up to 1080P CCTV analog camera and 5MP IP camera input). *Multiple ways to access on the PC, phone/pad and browser via softwares by the link on the user manual. *Support motion detection record and push notification. *Plug and play use, no need any complex installation. DVR Specifications: Processor: Hi3531 chip Operating System: Embedded Linux System Menu Display: 1/4/8/9/16 Screen Signal System: PAL/NTSC Frame Rate: 1-25fps (PAL), 1-30fps (NTSC) Recording resolution: Main-stream: 1080N/960H/D1 Compression Format: H.265+ Analog Input: 8*1080N,16*1080N,16*960H Network Input: 8*1080P, 8*960P, 4*5MP,4*3MP H-ybrid Input: 8*1080N (analog) + 8*960P (IPC) Max Sync Playback: 16channel 1080N Record Mode: Manual/Scheduled/Motion Detection Pre Record: 0-30s; Post Record: 0-300s Region Cover: Support 4 areas block Digital Zoom: support; Dual stream: support Video Input: 16ch BNC; Video Output: 1ch HD/VGA Audio Input: 2ch RCA; Audio Output: 1ch RCA Network Protocol: Onvif, HTTP, DHCP, PPPOE, DDNS, SMTP, FTP, RTSP OSD Language: English, German, French, Spanish, Italian, Japanese, Portuguese, Russian, etc DVR Resolution: 1920*1080, 1440*900, 1280*1024, 1280*720, 1024*768 Phone/Pad APP: support for Android/iOS OS APP Name: XMEye (can download on APP store or for Google Play) PC Software: support windows xp, win7, win8, win10, etc Browser: support IE, Safari, Chrome, Firefox, etc DVR Size: 26.1*22.7*4.5cm / 10.28*8.94*1.77in DVR Weight: 940g / 2.07Lb Package Size: 34.5*27.5*7.5cm / 13.6*10.83*2.95in Package Weight: 1499g / 3.3lb Camera Specifications: Image Sensor: 1/4inch CMOS Signal System: NTSC System Horizontal Resolution: 1500TVL 720P Pixels: 1.0MP, 1280*720 Light Sensor: Built-in IR Led: 24pcs, auto on/off IR-CUT Filter: Built-in Min. Illumination: 0 lux (IR on) Focus: 3.6mm fixed lens Night Vision Distance: 20-30m Waterproof Grade: IP66 Material: Aluminum alloy Camera Size (without bracket): 8.5*5.6*5.5cm Bracket Height: 7cm/2.76in Camera Weight (without bracket): 156g / 5.52oz Package List: If you choose 16pcs cameras 1 * KKmoon 16CH DVR (NO HDD) 16 * KKmoon 1500TVL AHD Camera 16 * Adjustable Bracket 16 * 60ft CCTV Cable 1 * Remote Control (2*AAA battery excluded) 5 * US Power Supply 4 * 1 to 4 Split Cable 1 * USB Mouse 16 * Bag of Screws for Camera Mounting 1 * Bag of Screws for HDD Installation 16 * KKmoon Warning Sign 1 * User Manual (English/German)",https://www.ebay.com/itm/KKMOON-16CH-5MP-Lite-H-265-DVR-720P-Outdoor-Security-Camera-System-Night-Vision/143808228349?var=442981852173?,149.99, FREE ,"Dayton, New Jersey, United States"
4,8CAM Security Camera System 720P Wired DVR Kit HD CCTV Outdoor/Indoor," BEST PRICING FREE SHIPPING HIGH QUALITY 8CAM Security Camera System 720P Wired DVR Kit HD CCTV Outdoor/Indoor DETAILS Key Features Advanced motion detection and email alert:Set a perimeter zone or a schedule to detect motion,when a camera detects motion,it will send an alert email to your smartphone and trigger recording( Setup email alarm in the DVR:Main menu---Set Up--- Alarm---Other Alarm ) 4 in 1 TVI DVR Main Features Video/Audio input :8 channel video input,4 channel audio input Video output: 1CH TV,1CH VGA,1CH HDMI HD output Display: 1/4/8 USB Interface: 3 x USB2.0 Trigger Event:Recording,PTZ,Tour,Alarm,Video Push,Email,FTP,Spot,Buzzer & Screen Tips Internal Hard drive: 1 SATA Port,Up to 6TB Recording Modes: Manual/Motion/Schedule/Recycle,Easily find and playback your security footage by searching a specific channel using date or time Ethernet: RJ-45 Port Max.User Asess: 10Users Remote Operation(via 3G/4G/WIFI): Via http using IE & iPhone,iPad,Android & PC Client PTZ Control: Support Dimension: L230*W230*H42mm Camera Main Features Model NO.:418 Image Sensor: 1/3"" Color CMOS with IR-Cut Horizontal Resolution: 720P(1280*720) Lens: 3.6mm IR LEDs Amount: 24 LEDs IR Distance: up to 65ft (20m) Waterproof Level: IP66 Weatherproof Package Contents 1 x ZOSI 8CH TVI DVR 8 x ZOSI 720P Camera 8 x 60FT BNC+DC CCTV cable for camera This is NOT A Wireless Camera System, but we offer 60FT CABLE for each camera. 3 x 12V/2000mA Power Supply 1 x Mouse 2 x 1 to 4 Power Splitter 8 x Mounting screw bag 1 x Instruction manual 1 x CD NO Hard drive included & Not support any external hard drive HDD Compatible with our DVR: Internal SATA 3.5"" Consumer Electronics HDD (1). QR code scan via mobile device using our free ZOSI View app (available on iOS/Android).Live view and playback on your smartphone. (2). 720P AHD-TVI Video(Not 1080P) - Get a sharp and crisp image day or night with the Weatherproof camera's automatic IR-cut filter. Up to 65ft night vision. (3). Ultra long continuous recording & easy USB backup:The TVI DVR can be set to automatically overwrite the oldest stored footage,and you can backup the records via the USB backup (4).【Internal hard drive not included. Cannot Record or Playback without Hard Drive.Must purchase separately! 】Intelligent motion detection email alert with images; Motion detection recording allows you save more capacity hard drive. (5). All systems CE & FCC certified with qualified power supplies.Guaranteed for 2 Year & Free life time Tech Support.//// Please refer to the last product images on the left side ,it will show you how to contact us for help ! Definitely respond within 24 hours! Height: 1218 x Length: 1808 x Weight: 2150 x Width: 1179 Shipping Shipping is FREE to all addresses other than APO/PO boxes in the lower 48 states, with the exception of ( CA, CT, FL, HI, MA, MD, MS, and TN) due to higher tax rates. Our stock all ships from our US-based warehouses. Shipped via USPS, UPS, or Fed Ex (depending on location and package weight). Unless stated otherwise, all orders will ship within 36 hours of your payment being processed. Check our feedback to see the great reviews of FAST shipping we offer. Note: We do not recommend P.O. Boxes. Providing a P.O Box maye result in delivery delays, and some items cannot be shipped to a P.O. Box at all. Please provide a PHYSICAL ADDRESS . Payment & Return PAY SAFE: PAYPAL PAYMENT IS ACCEPTED We offer a 30 day return policy for our products. We stand behind our products. Item's can be returned for exchange or full refund within 30 days from the date you receive your merchandise. We are not responsible for any purchase after this 30 day period. Return shipping is the responsibility of buyer unless the return is a result of our mistake. We will pay for shipping replacement back to you if an exchange is requested. If you have any questions please contact us through ""Ask seller a question"" link. We will respond within 1 business day or less. All returns must be done within 30 days of the date of purchase. Please note that we cannot give refunds after the 30 day limit has expired. When sending in a return, please note that it can take up to 7 business days for the return to be processed. We do our best to process as quickly as possible. DELIVERY TIMES Domestic lower 48 free shipping is expedited for item's. We have many different shipping locations depending on the product you buy and the shipping location that you choose. We try to ship most items within 36 hours of payment Monday-Friday. Most orders are in transit for two days but some may take longer. If you have a specific time frame please contact us before you make the purchase. Feedback 100% satisfied customers. It says it all. Thank you for shopping with us! BEST PRICING FAST SHIPPING HIGH QUALITY",https://www.ebay.com/itm/8CAM-Security-Camera-System-720P-Wired-DVR-Kit-HD-CCTV-Outdoor-Indoor/332573427974?,205.74, FREE ,"Multiple Locations, United States"
5,XVIM 5in1 4CH 1080P DVR 1920TVI IR Night Vision Home Security Camera System US," Pls note that the cameras are wired, not wireless Hard drive not included",https://www.ebay.com/itm/XVIM-5in1-4CH-1080P-DVR-1920TVI-IR-Night-Vision-Home-Security-Camera-System-US/112673492361?,94.99/ea, FREE ,"Cranbury, New Jersey, United States"
6,Samsung Wisenet - SmartCam D1 - WIRED Video Doorbell Camera - 1080p," Images shown are of a display model. You will receive a brand new item. *Please examine all pictures, and read condition notes. Feel free to contact us before or after purchase to resolve anything. Before contacting  or leaving negative feedback, contact us and we will happily resolve anything.",https://www.ebay.com/itm/Samsung-Wisenet-SmartCam-D1-WIRED-Video-Doorbell-Camera-1080p/274517134462?,27.27, FREE ,
7,HD Mini Camera Wireless WIFI IP Pinhole Home Security Micro DVR DIY Module USA," Feature: Description: Item Type: Security Camera Battery Capacity: 2800mah Microphone: Built-In Operating Voltage: 5W Shell Material: Plastic Video Resolution: 1080P/720P/640P/480P Weight: 170g Min. Illumination: 2 Lux Working Temperature: -10-60℃ Size: 10X8.7cn Video Recording Frame Rate: 25/30fps Lens View Angle: 90 Degree Memory: Support 32GB Micro Card In Max Operating Battery Life Time:4 Hours Web Browser: IE7 And Above, Chrome, Firefox, Safari.Etc Smart Phone Operating System: Iphone Ipad Or Android Battery Charging Voltage: DC 5V Video Format: ASF Player Software: Vlcplayer/Smplayer Features -- Real-Time Audio & Video Recording -- Support PC Computer View And Control -- 90 Degree Lens View Angle Package A: 1 * Safety Camera 1 * USB Cable 1 * User Manual How to connect it to your cell phone: 1.download the app with your home network scan code first 2.Choose app according to your mobile phone model 3. turn on the switch on the module 4.It will emit blue light after opening, and a new wireless network will appear in the wireless network list of your mobile phone. After connecting to the wireless network, you can see the video. Payment: PayPal only. Please leave clear & correct address in PAYPAL note. If you want to change delivery address pls contact us in time. Delivery Detail: NOTICE:There are always uncertainties during shipping, if your item does not show up over the period we estimate to arrive, please feel free to contact us, we'll solve the delivery problems for you. All items are shipped out within 24 hours after payment is received. We work on weekday, excluding weekend & holidays. Pls note that items purchased on weekends and Bank Holidays are dispatched the next working day. Local pick up is NOT available. Import duties, taxes and charges are not included in the item price or shipping charges. These charges are the buyer's responsibility. ONLY ship to PayPal shipping address. (Please make sure your PayPal shipping address is correct before finalizing order and submitting payment. We only ship to the shipping address submitted with the payment!) .We will not be responsible for item loss due to wrong or unknown address. Contact us: After receiving the item, cancel the purchase within30 days Return postage: Buyer pays return postage Return policy details: If you are not satisfied with the item,we can accept return. We do not undertake the shipping costs of return. Refund accepted: If item is broken when it arrives or,if there is any problem within 30 days; a refund is acceptable. Please leave us 5 perfect stars if you are satisfied with our service. If you are disatisfied,contact us first and we will resolve problems as much as we can do for you. We hope we can do all our best for you before you need to leave a negative feedback If you are not satisfied with the item,we can accept return. If you have any questions,Please Contact Us First,Thank you!(We Will Help Asap) Description: Item Type: Security Camera Battery Capacity: 2800mah Microphone: Built-In Operating Voltage: 5W Shell Material: Plastic Video Resolution: 1080P/720P/640P/480P Weight: 170g Min. Illumination: 2 Lux Working Temperature: -10-60℃ Size: 10X8.7cn Video Recording Frame Rate: 25/30fps Lens View Angle: 90 Degree Memory: Support 32GB Micro Card In Max Operating Battery Life Time:4 Hours Web Browser: IE7 And Above, Chrome, Firefox, Safari.Etc Smart Phone Operating System: Iphone Ipad Or Android Battery Charging Voltage: DC 5V Video Format: ASF Player Software: Vlcplayer/Smplayer Features -- Real-Time Audio & Video Recording -- Support PC Computer View And Control -- 90 Degree Lens View Angle Package A: 1 * Safety Camera 1 * USB Cable 1 * User Manual How to connect it to your cell phone: 1.download the app with your home network scan code first 2.Choose app according to your mobile phone model 3. turn on the switch on the module 4.It will emit blue light after opening, and a new wireless network will appear in the wireless network list of your mobile phone. After connecting to the wireless network, you can see the video. Location Descriptions In order to improve buyer's purchasing experience and let the buyer receive items as soon as possible, we currently set four warehouses in diffirent cities of United States . When the order is generated, we would send the item to the buyer from the nearest warehouse with sufficient inventory to the order receiving address. Hope you could get your item soon,if you have any problem,please contact us by email. Thanks for your understanding and support in advance! About us Delivery Detail Payment Return policy details About us Great Team. great Culture Were a customer-driven team of accountability people, who work in the environment of pul growth and learning. We focus on doing things well. We work in small, scrappy teams that experiment rapidly, fail fast, learn and iterate quickly. And we deliver bundle solution products that delight our users and customers throughout communityship network. SAGOSKATT= Idea Solution: The primary intention of the "" SAGOSKATT""is""Simply. to bring performance electronic accessories with solution to get rid of tech headache Smart guy can benefit from SAGOSKATT: Save your choosing time. Your time is invaluable. Worry-free ownership. Essential accessories at a great value Shopping with confidence. 100% satisfaction guaranteed. Contact easy By visiting us to chat, send us email or call us directly. You can leave us message even if we are offline during no-bu Return easy. If, for any reason, you are unsatisfied with your purchase, you may return it in its original condition within 30 days for a refund Let us make life simple Delivery Detail NOTICE:There are always uncertainties during shipping, if your item does not show up over the period we estimate to arrive, please feel free to contact us, we'll solve the delivery problems for you. All items are shipped out within 24 hours after payment is received. We work on weekday, excluding weekend & holidays. Pls note that items purchased on weekends and Bank Holidays are dispatched the next working day. Local pick up is NOT available. Import duties, taxes and charges are not included in the item price or shipping charges. These charges are the buyer's responsibility. ONLY ship to PayPal shipping address. (Please make sure your PayPal shipping address is correct before finalizing order and submitting payment. We only ship to the shipping address submitted with the payment!) .We will not be responsible for item loss due to wrong or unknown address. After receiving the item, cancel the purchase within30 days Return postage: Buyer pays return postage Payment PayPal only. Please leave clear & correct address in PAYPAL note. If you want to change delivery address pls contact us in time. Return policy details If you are not satisfied with the item,we can accept return. We do not undertake the shipping costs of return. If item is broken when it arrives or,if there is any problem within 30 days; a refund is acceptable. Please leave us 5 perfect stars if you are satisfied with our service. If you are disatisfied,contact us first and we will resolve problems as much as we can do for you. We hope we can do all our best for you before you need to leave a negative feedback If you are not satisfied with the item,we can accept return. On Dec-02-20 at 20:11:12 PST, seller added the following information:",https://www.ebay.com/itm/HD-Mini-Camera-Wireless-WIFI-IP-Pinhole-Home-Security-Micro-DVR-DIY-Module-USA/124469364362?,17.89, FREE ,"Gaithersburg, Maryland, United States"
