,new_title,new_description,new_link,new_price,new_ship_price,new_ship_how
16,For iPhone 12 11 Pro Max XS XR 78+ Slim PU Leather Card Slot Holder Wallet Case," Slim PU Leather Card Slot Holder Wallet Back Case Made from premium PU leather cover case. Back card pocket to conveniently store ID, credit cards. Easy access to all buttons,camera,speaker and connector. Protects your phone from dust, dirt, scratches & damages. Fit for iPhone 5/5S/SE, For iPhone 12 Mini 5.4inch, For iPhone  12/12 Pro 6.1inch, For iPhone 12 Pro Max 6.7inch, For iPhone 11 Pro Max,  For Apple iPhone 11 Pro, For iPhone 11 Pro, For iPhone 11, For iPhone  XS Max, For iPhone XR, For iPhone X/XS, For iPhone 7/8 Plus, For iPhone  7/8 Description Shipping Returns & Exchanges Made from premium PU leather cover case. Back card pockets to conveniently store ID, credit cards & cash. Easy access to all buttons,camera,speaker and connector. Protects your phone from dust, dirt, scratches & damages. Fit for iPhone 5/5S/SE, For iPhone 12 Mini 5.4inch, For iPhone  12/12 Pro 6.1inch, For iPhone 12 Pro Max 6.7inch, For iPhone 11 Pro Max,  For Apple iPhone 11 Pro, For iPhone 11 Pro, For iPhone 11, For iPhone  XS Max, For iPhone XR, For iPhone X/XS, For iPhone 7/8 Plus, For iPhone  7/8 Packages are sent out from our Los Angeles warehouse in California. All packages will be shipped within 1-2 business days using USPS/DHL depending on your location. Please allow 2-8 business days for you to receive your package. Returns or exchanges will be accepted 30 days after receiving your order. If you have any questions please contact us and we will try to answer all questions immediately. Free shipping Customer Support 30 Day Guarantee",https://www.ebay.com/itm/For-iPhone-12-11-Pro-Max-XS-XR-78-Slim-PU-Leather-Card-Slot-Holder-Wallet-Case/193743115720?var=493968694360?,7.99/ea, FREE ,"La Puente, California, United States"
17,Glitter Sparkle Bling Cute Case For iPhone 12 Pro Max mini 11 XR XS MAX 7 8 Plus," 无标题文档 Description Compatible with: Apple iPhone 12mini,12/12pro, 12 pro max, 11/11 Pro/11 Pro Max, XS MAX/XR, 7/7 Plus, 8/8 Plus Features: 100%brandnew.Fashione Design with bling glitter pieces Thisstylishphonecasehasbeenspeciallydesignedtoholdyourphone. HighQuality. Accurateholeposition,goodhandle. Easyinstallationrequirenotools. Protectyourphonefrombumpsandotherdailydamage. Package included: 1 x Bling case for Apple iPhone Information about Payment We accept PayPal only. After you have won the auction, an email will be sent to your  registered email address by . If you are paying through PayPal using eCheck, your item can be shipped only after eCheck has cleared ( it may take 5-10 working days to be cleared). All payments are expected within 7 days after the last winning auction is closed. A non-payment dispute will be opened if full payment is not received . Shipping Please  make sure your shipping address is correct when you make order(s). We don't accept address change after order. We will not be responsible for any lost if the shipping address is wrong or incompleted. We ship from U.S Warehouse for U.S buyer (3-7 working days to arrive) Our shipping rates include the cost of shipping, handling, packaging and related manpower costs. Items  are generally shipped out with 1 business day after your payment has been cleared (Sat. & Sun. & Public holiday excluded.). Local pick up is not available. About us We are professional worldwide wholesale company.We supply many products including Consumer Electronics, Cellphone Accessories,iPhone & iPad Accessories and so on! Contact us Your positive feedback with comments are extremely valuable to us. If you have any concerns about your order, please contact us through  Message to resolve any issues before leaving a negative feedback or opening a dispute. We will reply within 1 business days (public holidays not included). Please always contact or check our response in ""  messages "" in your your  account. Gurantee & Returns We offer a 100% satisfaction guarantee. In case you won't be 100% satisfied with your purchase, simply send us an  Message within 3 days of receiving the item and tell us the issue. Please contact us (via  message) before return, a return form and the return address will be given after your return request has been issued. Any return without authorization will not be accepted You may return the item for refund or exchange within 30 days upon receiving shipment. All return items must be in original package and not be used. Our customer service personnel will inspect the returned item before refund or exchange. Customers will be responsible for the return postage if it is not our fault. We don’t accept any return of physical damaged item by yourself. After 14 days, we can only make replacement or repair and customers need to be responsible for the return postage.",https://www.ebay.com/itm/Glitter-Sparkle-Bling-Cute-Case-For-iPhone-12-Pro-Max-mini-11-XR-XS-MAX-7-8-Plus/124415144657?var=425283944789?,6.98/ea, FREE ,"Rowland Heights, California, United States"
18,For iPhone 12 11 Pro MAX XR 7 8 Plus Case Glitter Shockproof Bumper Hybrid Cover," 无标题文档 Item Description Features: Protects phone from damage and scratches Fits perfectly to while providing easy access to functions 5 Beautiful Types to choose from Easy installation and disassembly Package Includes 1X iPhone Case Information about Payment We accept PayPal only. After you have won the auction, an email will be sent to your  registered email address by . If you are paying through PayPal using eCheck, your item can be shipped only after eCheck has cleared ( it may take 5-10 working days to be cleared). All payments are expected within 7 days after the last winning auction is closed. A non-payment dispute will be opened if full payment is not received. Shipping Please make sure your shipping address is correct when you make order(s). We don't accept address change after order. We will not be responsible for any lost if the shipping address is wrong or incompleted. We ship from U.S Warehouse for U.S buyer (3-7 working days to arrive) Our shipping rates include the cost of shipping, handling, packaging and related manpower costs. Items are generally shipped out with 1 business day after your payment has been cleared (Sat. & Sun. & Public holiday excluded.). Local pick up is not available. About Us We are professional worldwide wholesale company.We supply many products including Consumer Electronics, Cellphone Accessories,iPhone & iPad Accessories and so on! Contact Us Your positive feedback with comments are extremely valuable to us. If you have any concerns about your order, please contact us through  Message to resolve any issues before leaving a negative feedback or opening a dispute. We will reply within 1 business days (public holidays not included). Please always contact or check our response in ""  messages "" in your your  account. Return Policy We offer a 100% satisfaction guarantee. In case you won't be 100% satisfied with your purchase, simply send us an  Message within 3 days of receiving the item and tell us the issue. Please contact us (via  message) before return, a return form and the return address will be given after your return request has been issued. Any return without authorization will not be accepted You may return the item for refund or exchange within 30 days upon receiving shipment. All return items must be in original package and not be used. Our customer service personnel will inspect the returned item before refund or exchange. You will be responsible for the return postage. We don’t accept any return of physical damaged item by yourself. After 14 days, we can only make replacement or repair and customers need to be responsible for the return postage.",https://www.ebay.com/itm/For-iPhone-12-11-Pro-MAX-XR-7-8-Plus-Case-Glitter-Shockproof-Bumper-Hybrid-Cover/353177015063?var=622377436930?,6.89/ea, FREE ,"Rowland Heights, California, United States"
19,K3 Wall Mount Automatic Infrared Thermometer Digital Non Contact Forehead Stand," Features: 1. Infrared thermometer, non-contacting, digital display, no need to hold hands to avoid cross infection. 2. Digital measuring_thermometer detection fever alarm.There is a warning when the detection fails or abnormal temperature.Abnormal automatic alarm, flash + beep. 3. High-definition display, 5 meters viewing distance.Non-working time 5s standby, red dot dynamic cycle, standby time about one week. 5cm-10cm (automatic measurement) 4. Wall-mounted infrared thermometer can be applied in different occasions, such as office, subway, shopping mall, community, etc public area thermometer . Specification: Material:PP Color:White NOTE: Can install three 1.5V AAA batteries (delivery without batteries) Package includes: 1*Infrared thermometer",https://www.ebay.com/itm/K3-Wall-Mount-Automatic-Infrared-Thermometer-Digital-Non-Contact-Forehead-Stand/303792014640?,21.93/ea, FREE ,"Vashon, Washington, United States"
20,K3 Wall-Mount Digital Infrared Thermometer Automatic No-Contact Forehead Fast x," Features: 1. Infrared thermometer, non-contacting, digital display, no need to hold hands to avoid cross infection. 2. Digital measuring_thermometer detection fever alarm.There is a warning when the detection fails or abnormal temperature.Abnormal automatic alarm, flash + beep. 3. High-definition display, 5 meters viewing distance.Non-working time 5s standby, red dot dynamic cycle, standby time about one week. 5cm-10cm (automatic measurement) 4. Wall-mounted infrared thermometer can be applied in different occasions, such as office, subway, shopping mall, community, etc public area thermometer . Specification: Material:PP Color:White Battery: can hold three 1.5V AAA batteries (not included) Package includes: 1*Infrared thermometer",https://www.ebay.com/itm/K3-Wall-Mount-Digital-Infrared-Thermometer-Automatic-No-Contact-Forehead-Fast-x/224275576137?,22.99/ea, FREE ,"Denver, Colorado, United States"
21,Fast Wall Mount Digital Infrared Thermometer Automatic Non Contact Forehead USA," Features: 1. Noncontact to avoid cross infection. 2. High-definition display, 5 meters viewing distance. 3. High temperature measurement accuracy, accuracy tolerance: ±0.2 (32~43℃). 4. With warning light for detection failure and warning light for abnormal temperature. 5. Can be applied in different occasions. Office/ Subway/ Family/ Superstore/ Shop/ Community/ Entrance etc. 6. Using a new chip, the induction time is faster (0.1 s); the pass rate per minute is greatly improved (50 people/min). Specifications: Standby: 5s Distance: 1 ~ 10cm Display: digital display Response time: 500 ms Working wave: 5 microns Dimensions: 150*120*32 mm Ambient temperature: 5 ~ 45℃ Measuring temperature: 0 ~ 80℃ Accuracy tolerance: ±0.2 (32~43℃) Theory: F and C degrees (Fehrenheit and Certigrade) Power supply: USB/TYPE-C/3* AA (not included) Placement method: hanging / double-sided adhesive tape / bracket fixing Measurement method: infrared thermometer without contacting on the forehead Automatic alarm for abnormal temperature: red light flashes with continuous alarm sound Package Includes: 1 X Thermometer 1 X USB Cable 1 X User Manual",https://www.ebay.com/itm/Fast-Wall-Mount-Digital-Infrared-Thermometer-Automatic-Non-Contact-Forehead-USA/143893989769?,19.99/ea, FREE ,"Sterling Heights, Michigan, United States"
22,US Wall-Mount Digital Automatic Non-contact Thermometer With 6 Languages," US Wall-Mount Digital Automatic Non-contact Thermometer With 6 Languages Feature: - It can switch between Fahrenheit and Celsius measurement with one click, which is very convenient. - Can be applied in different occasions. Office/ Subway/ Family/ Superstore/ Shop/ Community/ Entrance etc. - Noncontact infrared technology reads from forehead, prevents cross-infection between multiple people, fast and accurate temperature measurement. Specifications: Maximum error: ±0.2°C Response time: 0.5 second Measuring distance: 1-10cm Measuring range: -10~50°C Display unit: Celsius (°C) and Fahrenheit (°F) Package included: 1 x Thermometer",https://www.ebay.com/itm/US-Wall-Mount-Digital-Automatic-Non-contact-Thermometer-With-6-Languages/293815118232?,19.99/ea, FREE ,
23,Wall Mount Digital Infrared Thermometer Automatic Non Contact Forehead Scan K-3S," Medical Infrared Non-Contact Digital Forehead IR Thermometer Features: - It can switch between Fahrenheit and Celsius measurement with one click, which is very convenient. - Can be applied in different occasions. Office/ Subway/ Family/ Superstore/ Shop/ Community/ Entrance etc. - Noncontact infrared technology reads from forehead, prevents cross-infection between multiple people, fast and accurate temperature measurement. Specifications: Maximum error: ±0.2°C Response time: 0.5 second Measuring distance: 1-10cm Measuring range: -10~50°C Display unit: Celsius (°C) and Fahrenheit (°F) Power By: USB power supply and 3* AA battery power supply (Package Not include battery ). Package included: 1 x Thermometer ( Not include battery ) Notes: 1. Manual measuring, please allow 1 ~ 3mm error,thank you. 2. Due to the difference between different monitors, the picture may not reflect the actual color of the item. We guarantee the style is the same as shown in the picture.",https://www.ebay.com/itm/Wall-Mount-Digital-Infrared-Thermometer-Automatic-Non-Contact-Forehead-Scan-K-3S/393018996852?,24.93/ea, FREE ,"Altoona, Pennsylvania, United States"
24,Fast Wall Mount Digital Infrared Thermometer Automatic Non Contact Forehead US," Does not include batteries! You can use a USB connection, or put in a battery. Features: - Noncontact to avoid cross infection. - High-definition display, 5 meters viewing distance. - High temperature measurement accuracy, accuracy tolerance: ±0.2 (34~45℃). - With warning light for detection failure and warning light for abnormal temperature. - Can be applied in different occasions. Office/ Subway/ Family/ Superstore/ Shop/ Community/ Entrance etc. - Using a new chip, the induction time is faster (0.1 s); the pass rate per minute is greatly improved (50 people/min). Specifications: Standby: 5s Distance: 5 ~ 10cm Display: digital display Response time: 500 ms Working wave: 5 microns Dimensions: 170*115*140 mm Ambient temperature: 5 ~ 45℃ Measuring temperature: 0 ~ 80℃ Accuracy tolerance: ±0.2 (34~45℃) Theory: F and C degrees (Fehrenheit and Certigrade) Power supply: USB/1* 18650 lithium battery (not included) Placement method: hanging / double-sided adhesive tape / bracket fixing Measurement method: infrared thermometer without contacting on the forehead Automatic alarm for abnormal temperature: red light flashes with continuous alarm sound Package Included: 1 X Thermometer 1 X USB Cable 1 X User Manual Notes: 1. Manual measuring, please allow 1 ~ 3mm error, thank you. 2. Due to the difference between different monitors, the picture may not reflect the actual color of the item. We guarantee the style is the same as shown in the picture.",https://www.ebay.com/itm/Fast-Wall-Mount-Digital-Infrared-Thermometer-Automatic-Non-Contact-Forehead-US/303730164753?,33.99/ea, FREE ,"Los Angeles, California, United States"
25,Fast Wall Mount Digital Infrared Thermometer Automatic Non Contact Forehead US," Does not include batteries! You can use a USB connection, or put in a battery. Features: - Noncontact to avoid cross infection. - High-definition display, 5 meters viewing distance. - High temperature measurement accuracy, accuracy tolerance: ±0.2 (34~45℃). - With warning light for detection failure and warning light for abnormal temperature. - Can be applied in different occasions. Office/ Subway/ Family/ Superstore/ Shop/ Community/ Entrance etc. - Using a new chip, the induction time is faster (0.1 s); the pass rate per minute is greatly improved (50 people/min). Specifications: Standby: 5s Distance: 5 ~ 10cm Display: digital display Response time: 500 ms Working wave: 5 microns Dimensions: 170*115*140 mm Ambient temperature: 5 ~ 45℃ Measuring temperature: 0 ~ 80℃ Accuracy tolerance: ±0.2 (34~45℃) Theory: F and C degrees (Fehrenheit and Certigrade) Power supply: USB/1* 18650 lithium battery (not included) Placement method: hanging / double-sided adhesive tape / bracket fixing Measurement method: infrared thermometer without contacting on the forehead Automatic alarm for abnormal temperature: red light flashes with continuous alarm sound Package Included: 1 X Thermometer 1 X USB Cable 1 X User Manual Notes: 1. Manual measuring, please allow 1 ~ 3mm error, thank you. 2. Due to the difference between different monitors, the picture may not reflect the actual color of the item. We guarantee the style is the same as shown in the picture.",https://www.ebay.com/itm/Fast-Wall-Mount-Digital-Infrared-Thermometer-Automatic-Non-Contact-Forehead-US/274612668542?,30.29/ea, FREE ,"Deer Park, New York, United States"
26,Car Vehicle Winter Snow Shovel Ice Scraper Snow Broom Removal Tool Shovel Brush," Store category Sign Up Now ! You may also like Car Vehicle Winter Snow Shovel Ice Scraper Snow Broom Removal Tool Shovel Brush Product Description Features: This snow shovel is made of ABS material and works fine. The design of the entire snow shovel conforms to the mechanics principle, which is convenient and labor-saving. Can be use to shoveling snow, deicing, wiping water and defrost. Portable size, easy to carry and storage. Suitable for all types of vehicles. Soft and not hurting the car, not easy to deform. Specification: Material: ABS Color: black & blue Size: 14cm x 25cm Weight: 220g Package includes: 1 x Car Snow Shovel Payment Delivery details Terms of sales About us Contact us Payment We accept PayPal only. Please fill in a valid contact address. Delivery details →We are not responsible for undeliverable address. We reserve the right to charge the shipping fee again for returned items due to wrong address supplied by buyer. Any non-received items caused by invalid address registered on PayPal are not in our full refund or replacement policy. →Items are generally shipped out with 2 business day after your payment has been cleared (Sat. & Sun. & Public holiday excluded.) →Our orders are shipped via epacket delivery  with Tracking Number,andfrom the United States will all be shipped out via USPS.If your order has not arrived within 20 business days, or if there is an issue with tracking, please do not hesitate to contact us. Terms of sales We offer hassle-free returns and exchanges on all our products. We do not have a restocking fee! We feel that restocking fees discourage potential buyers and are not fair to customers who genuinely do not like or want the product. If you are not completely satisfied with your purchase, please contact us directly and we will do everything in our power to resolve any issue. Our warranty does not extended to any products that are physically damaged or that are not under normal operating conditions as a result of misuse or improper installation on the buyer/user's part. For all returned products, buyers MUST contact us for the returning address. About us → We will issue refund or resend it if the item is not arrived within 35 days(or 28 business days) after receiveing the payment. Please contact us by  message if you can't receive it on time. → If you received an incorrect, damaged, defective, or item not as described, please contact us for a partial/full refund or replacement on our cost, we will be pleased if you can offer a photo to us through  message. → Please contact us within 7 days after you received . Contact us Your feedback is very important to us, please leave us a positive feedback with all 5-star for the Detailed Selling Rating when you received the item. If there is some problem about the product, please take communication with us before leaving neutral/negative feedback or opening /paypal case, we will do our best to resolve your problem. We try our best to reply to your emails as soon as possible, however, due to high volume of daily incoming emails and time zone difference; we may not be able to reply your emails immediately. Please allow 24 business hours for us to response.",https://www.ebay.com/itm/Car-Vehicle-Winter-Snow-Shovel-Ice-Scraper-Snow-Broom-Removal-Tool-Shovel-Brush/184496171246?,10.99, FREE ,"Hebron, Kentucky, United States"
