,new_title,new_description,new_link,new_price,new_ship_price,new_ship_how
0,durable Exercise Treadmill with Handrail Ultra-thin Foldable Running Walkingpad With LCD Display Indoor Mute Fitness Equipment,"Cheap Treadmills, Buy Quality Sports & Entertainment Directly  Suppliers:durable Exercise Treadmill with Handrail Ultra thin Foldable Running Walkingpad With LCD Display Indoor Mute Fitness Equipment Enjoy ✓Free Shipping ! ✓Limited Time Sale✓Easy Return.",https://www.aliexpress.com/item/1005001805778039.html?,225.00,Free Shipping,to United States via USPS
1,Electric Mechanical Treadmill Household Gym Treadmill Running Machine with LED Display Safe Bar Folding Silent Mini Treadmill,"Cheap Treadmills, Buy Quality Sports & Entertainment Directly  Suppliers:Electric Mechanical Treadmill Household Gym Treadmill Running Machine with LED Display Safe Bar Folding Silent Mini Treadmill Enjoy ✓Free Shipping ! ✓Limited Time Sale✓Easy Return.",https://www.aliexpress.com/item/1005001909720513.html?,171.94,Free Shipping,to United States via USPS
2,US STORE Folding Electric Treadmill Home Electric Treadmill Ultra-thin Mini Fitness Equipment Foldable Home Treadmill Machine,"Cheap Treadmills, Buy Quality Sports & Entertainment Directly  Suppliers:US STORE Folding Electric Treadmill Home Electric Treadmill Ultra thin Mini Fitness Equipment Foldable Home Treadmill Machine Enjoy ✓Free Shipping ! ✓Limited Time Sale✓Easy Return.",https://www.aliexpress.com/item/1005001873139959.html?,190.33,Free Shipping,to United States via USPS
3,Abdominal Muscle Trainer EMS Electric Muscle Exerciser Machine For Body Slim Weight Loss Fat Burning Workout Home GymEquipment,"Cheap Accessories, Buy Quality Sports & Entertainment Directly  Suppliers:Abdominal Muscle Trainer EMS Electric Muscle Exerciser Machine For Body Slim Weight Loss Fat Burning Workout Home GymEquipment Enjoy ✓Free Shipping ! ✓Limited Time Sale✓Easy Return.",https://www.aliexpress.com/item/4000163754909.html?,3.82 - 20.34,Shipping: 5.45,to United States via USPS
4,Body Slimming EMS Hip Trainer Muscle Stimulator Electric Butt Buttock Vibration Massager Bodybuilding Machine Home Workout Gym,"Cheap Integrated Fitness Equipments, Buy Quality Sports & Entertainment Directly  Suppliers:Body Slimming EMS Hip Trainer Muscle Stimulator Electric Butt Buttock Vibration Massager Bodybuilding Machine Home Workout Gym Enjoy ✓Free Shipping ! ✓Limited Time Sale✓Easy Return.",https://www.aliexpress.com/item/1000008623030.html?,7.45,Free Shipping,to United States via  Standard Shipping
5,Electric EMS Foot Massager Foot Muscle Stimulator Massager Wireless Low Frequency Feet Physiotherapy ABS Stimulator Massage Mat,"Online Shopping at a cheapest price for Automotive, Phones & Accessories, Computers & Electronics, Fashion, Beauty & Health, Home & Garden, Toys & Sports, Weddings & Events and more; just about anything else Enjoy ✓Free Shipping ! ✓Limited Time Sale✓Easy Return.",https://www.aliexpress.com/item/33010721339.html?,11.99 - 19.99,Free Shipping,to United States via USPS
