,new_title,new_description,new_link,new_price,new_ship_price,new_ship_how
8,Waterproof Bluetooth Smart Watch Phone Mate Fitness Tracker For All Smart Phone," Watch Specifications: Please see this video as a reference for details: https://www.youtube.com/watch?v=kmlukMnD2SA * You may need a SIM card and a Storage Card to get the full functions. * Waterproof for general daily use, but should not be used swimming or in shower. * Surface Treatment Technology: Stainless Steel Wire Drawing Primary Color * CPU: MTK6261D * Weight: 1.76oz / 50g * Dimensions: (9.65 x 1.57 x 0.49)"" / (24.5 x 4 x 1.25) cm * LCD: 1.3′′ inch TFT High Definition LCD * Resolution: 240 x 240 pixel * Frequency: 360MHz * Screen: OGS Capacitive Touch Screen * Bluetooth: Ver 3.0 * Battery of smartwatch: 350mAh Polymer Battery * Bluetooth Connection Standby: >1 Week; * Capacity: 128M+64M; Support 32 GB Max. TF Storage Card (Not Included with the Product) * Compatibility: Android 4.2 and above, iOS system * G-sensor: Support Pedometer Analysis,Sedentary Remind,Sleep Monitoring; Anti-lost; Remote Take Picture * Language: English, Russian,German, Polish, French, Dutch, Spanish, Portuguese, Turkish, Italian,Arabic,Chinese 30 Days Free Return. 90 Days Warranty.",https://www.ebay.com/itm/Waterproof-Bluetooth-Smart-Watch-Phone-Mate-Fitness-Tracker-For-All-Smart-Phone/164344074587?var=464007834394?,17.45, FREE ,"Houston, Texas, United States"
9,US Mini Portable Fast Heater Heated Heating Electric Hot Air Fan Space Desk 400W," US Mini Portable Fast Heater Heated Heating Electric Hot Air Fan Space Desk 400W Item Description Note: This item comes with US plug, please confirm the voltage of your area before purchasing. Description Are you looking for a professional, yet affordable heater fan? Are you in search of a sturdy, trustworthy tool that can do multiple jobs at once? If yes, look no further! Our professional heater fan must meet you needs. It is one of the best choices for you. Features - Color: White/black - Material: ABS, PA - Size: 27.00X13.00X21.00cm/10.61X5.11X8.25in. - Rated power: 350-400W. - Rated frequency: 50Hz. - Rated voltage: AC220V. - Plug voltage: 110V. - Built-in high quality heating core, highly efficient heating. - Mini and portable, suitable for home or office use. - This small heater offers you a warm and comfortable space. - Low noise will not disturb your resting, sleeping, reading, work, etc. - Made of high grade material, durable in use. Package Included 1 x air heater Detail Images Shipment All item will be carefully packaged very well with safe material and shipped to US States. Items will be sent in 2 working days,usually shipped by USPS Priority Mail. It will take about 3-5 days to US addresses. If you would like to ship by other shipment methods,please contact us.( shipping cost will be combined for multiple items you purchase at a time.) Payment Only PayPal is acceptable.It is a safe and easy payment method for buyers. Please pay in 48 hours after you win the item(s).If payment cannot be made in five days,your order(s) will be claimed as unpaid case and the item will be relisted. Return & Refund Customer satisfaction is our first priority. 30-days return is available after delivery. However, return shipping and insurance cost will be on buyers. Please email us before returning. Delivery date will be different according to UPS or USPS tracking system, so please inspect your item immediately upon arrival. Money will be return to you after the return item is sent back. We can not refund to you, if your return item is broken or damaged. Please ensure its safety. Feedback Your feedback is very important to us. If you can't leave us a ""5-Star"" rating and a positive feedback, please contact us without hesitation before leaving feedback. We are eager to work with our customers. We believe in communication. Give us a call or send us an email, we will make things right for our buyers. Positive feedback for our buyers will be left automatically by  Seller Manager Pro.",https://www.ebay.com/itm/US-Mini-Portable-Fast-Heater-Heated-Heating-Electric-Hot-Air-Fan-Space-Desk-400W/193752419857?var=493978313252?,14.35, FREE ,"El Monte, California, United States"
10,Portable Electric Mini Heater 400W Space Fan Heater No Noise Office Room Desk US," The  portable personal heater uses highest standard material and heating  element, it brings you warmth and comforts wind high safety performance.  The heater has strong durability and features with a energy-saving,  safe and beautiful and compact. Specification: Material： ABS Rated Voltage: 110V Rated Power: 400W Switch Type : normal button Types of Heating Appliances: heater Heating Method: Electric Heating Wire Power Supply: Wall Plug-in Cable Length: 5 inch Rated Frequency : 50HZ Heating Element: PTO Speed Control Gear : 2 gears Heating Method : electric heating wire Air Supply Mode : Leafless turning, No head shaking Applicable Area: 11㎡(inclusive)-20㎡(inclusive) Maximum Heating Area: 20m^2 or less Features: - 3.0 Upgraded Version of the Leafless Heater : The small electric heater is mini but with high energy. - 2 Second Fast Heating : Using  high-quality thread heating wire for heating, not only has a long life,  but also can quickly form a constant temperature state within 1-2  seconds. High efficiency and energy saving. - Quiet Operation : Working volume is 50db, like people whispering. Compared to the traditional heater, ideal for work, reading or sleeping. - Tilt protection: Ventilation  holes are designed at the bottom, which is safe even if accidentally  dumped, providing safety protection. When the machine is tilted 45 to  60º, even if the heater is upside down, the bottom of the heater is  ventilated and it is safe to dump. - Overheating Protection: 1. Comprehensive safety protection design. Built-in temperature  detection sensor, when the temperature of the inner cavity is detected,  it will automatically cut off the power when it exceeds 70℃. 2. it  will automatically cut off the power for safe use, continue heating when  it drops to 40 degrees, and stop heating when the temperature near the  heating wire exceeds 80 degrees. - Keep Kids Safety: I ntelligent  heat dissipation, while ensuring the heating effect, the temperature of  the machine is controlled at about 50 degrees. Children's hands will  not be burned when they reach in, and they will not be hot. - Bedroom Heater: Our mini heater makes lower than 50 dB sound, silent enough for most people to use in a bedroom while sleeping. Great  for using in dorm, bedroom, living room, RV, hot yoga, etc - Wide Application Range : Mini portable heater is very suitable for indoor, home, and office use,  but not suitable for bathroom, laundry area or other high humidity  rooms. - Bring this warmth to everyone around you ,  save space without taking up space, let the desktop and the floor, just  put it on, the heating will come, and some practical gifts in winter  for family, girlfriend, and children Package： 1* 400W Mini Portable Electric Heater Warm Tips : 1. Avoid placing the heater in an overheated or humid place, away from textiles and water sources. 2.  Do not cover the air outlet when using the air heater. It is suggested  that the machine should be shut down in about 3 hours to avoid the aging  of machine accessories, so as to improve the use efficiency. 3. Please do not let the heater tip over or let children and old people use it alone to avoid accidents. 4. do not clean the heater at work, do not use spray cleaner. 5. There will be a little plastic smell at the beginning of use, which is a normal phenomenon.",https://www.ebay.com/itm/Portable-Electric-Mini-Heater-400W-Space-Fan-Heater-No-Noise-Office-Room-Desk-US/293656131135?,26.97/ea, FREE ,"Piscataway, New Jersey, United States"
11,For iPhone 12 Pro Max 11 XS Max XR 6 7 8 Epoxy Glitter Sparkle Bling Case Cover," For iPhone 12 Pro Max 11 XS XR 6 7 8 Glitter Bling  Mirror Diamond Case w/ Ring 9.99 USD Free shipping For iPhone 12 11 Pro Max XS XR 6 7 8 Glitter Marble Butterfly Diamond Case Cover 10.99 USD Free shipping For iPhone 12 11 Pro XS Max XR 7 8 6 Bling Diamond Rhinestone Ring Holder Case 10.99 USD Free shipping For iPhone 12 Pro Max 11 XS XR 6 7 8 Bling Glitter Diamond Flowers Case Cover 9.99 USD Free shipping Bling Diamond Rhinestone Ring Holder Case for iPhone 12 Pro Max 11 XS XR 6 7 8 10.85 USD Free shipping Bling Glitter Luxury Metal Square Case Cover For iPhone 12 11 Pro XS Max XR 7 8 9.99 USD Free shipping For iPhone 12 Pro Max 11 XS XR 7 8 Bling Sparkle Glitter Diamond Rhinestone Case 9.99 USD Free shipping For iPhone 12 11 Pro Max XS XR 7 8 Epoxy Glitter Sparkle Side Diamond Case Cover 9.95 USD Free shipping For iPhone 12 11 Pro Xs MAX XR 7 8 Epoxy Glitter Sparkle Side Diamond Case Cover 10.59 USD Free shipping Glitter Bling Luxury Snake Diamond Phone Case for iPhone 12 11 Pro Max XS XR 7 8 13.95 USD Free shipping For iPhone 12 11 Pro XS Max XR 7 8 6 Bling Diamond Rhinestone Mirror Holder Case 10.85 USD Free shipping For iPhone 11 12 Pro Max XS XR 8 Bling Sparkle Diamond Perfume Bottle Case Cover 14.38 USD Free shipping For iPhone 12 11 Pro Max XS XR 7 8 Luxury Marble Flower Metal Square Case Cover 10.99 USD Free shipping For iPhone 12 Pro Max 11 XS XR 8 7 Luxury Retro Square Marble Glitter Case Cover 9.99 USD Free shipping For iPhone 12 11 Pro Max XS XR 6 7 8 Bling Diamond Ring Crystal Chain Case Cover 10.95 USD Free shipping Luxury Bling Diamond Phone Case Cover for iPhone 12 Pro Max 11 Pro XS XR 8 7 6 9.99 USD Free shipping For iPhone 12 11 Pro Max XS XR 8 7 6 Bling Sparkle Diamond Gradient Case Cover 9.69 USD Free shipping For iPhone 12 11 Pro Max XS XR 6 7 8 Luxury Retro Marble Metal Square Case Cover 10.99 USD Free shipping Product Description Feature: 1.Design to fit your phone perfectly! 2.Bling style, make you and your phone look charming and fashionable! 3.High-quality TPU soft inner frame maximum protects your phone from drop and scratch protection. 4.Precise cut easy access to all ports, sensors, speakers, cameras and all features. 5.Fashionable, unique, striking, great for party or everyday use. Material: TPU, Diamond, Rhinestone Package Include: 1 * Phone Case 1 * Crystal Rope Please Note: Pictures are only for style display,deliverywill be according to your selected model and color, don't worry about the wrong hole position. Compatibility: Apple iPhone 6/6S, iPhone6/6S Plus, iPhone 7/8, iPhone 7/8 Plus, iPhone X/XS, iPhone XR, iPhone XS Max, iPhone 11, iPhone 11 Pro, iPhone 11 Pro Max, iPhone 12 Mini, iPhone 12/12 Pro, iPhone 12 Pro Max Payment Shipping Return Feedback Contact us 1. Pay secure with any major credit card through PayPal. 2. For International buyers, Import duties, tax and charges are not included in the item price or shipping charge. 1. Item will be shipped within 24 hours on payment received, except weekends and holidays. 2. We will ship from CA or NY (it depends on your address), it usually takes 1-6 business days. 1. We accept 30 days return. All return & exchange must be in NEW  & UN-USED condition. Please tell us the return tracking number in  time. When we receive return package, we will issue the refund to  you after checking. Shipping & Handling fee is not refundable. 2. Buyer pay for all return shipping postage fee. 3.  Any faulty due to improper installation or improper use will NOT be  covered by the warranty. Any physical damage such as soldering or  modified bases will void the warranty too. 1. Feedback will be left automatically after receiving buyer feedback. 2. Please contact us before leaving a Negative & Neutral feedback. We will try our best to help you solving any problem. Any question please feel free to contact us, we will get back to you within 24 hours. Payment 1. Pay secure with any major credit card through PayPal. 2. For International buyers, Import duties, tax and charges are not included in the item price or shipping charge. Shipping 1. Item will be shipped within 24 hours on payment received, except weekends and holidays. 2. We will ship from CA or NY (it depends on your address), it usually takes 1-6 business days. Return 1. We accept 30 days return. All return & exchange must be in NEW  & UN-USED condition. Please tell us the return tracking number in  time. When we receive return package, we will issue the refund to  you after checking. Shipping & Handling fee is not refundable. 2. Buyer pay for all return shipping postage fee. 3.  Any faulty due to improper installation or improper use will NOT be  covered by the warranty. Any physical damage such as soldering or  modified bases will void the warranty too. Feedback 1. Feedback will be left automatically after receiving buyer feedback. 2. Please contact us before leaving a Negative & Neutral feedback. We will try our best to help you solving any problem. Contact us Any question please feel free to contact us, we will get back to you within 24 hours. powered by For iPhone 12 11 Pro Max XS XR 7 8 6 Bling Glitter Crossbody Case Leather Wallet 12.58 USD Free shipping For iPhone 12 11 Pro XS Max XR 7 8 Bling Diamond  Rhinestone Wallet Leather Case 11.99 USD Free shipping For iPhone 12 Pro Max 11 XS XR 6 7 8 Glitter Bling Diamond Mirror w/ Ring Case 9.85 USD Free shipping For iPhone 12 Pro Max 11 XS XR 7 8 Glitter Diamond Butterfly Case w/ Ring&Strap 10.85 USD Free shipping For iPhone 12 Pro Max 11 XS XR 6 7 8 Glitter Diamond Mirror w/ Ring Holder Case 10.99 USD Free shipping For iPhone 12 Pro Max 11 XS XR 7 8 Glitter Sparkle Diamond Case Cover with Ring 9.99 USD Free shipping Bling Diamond Side Rhinestone Clear Case For iPhone 12 Pro Max 11 XS XR 6 7 8 9.99 USD Free shipping For iPhone 12 Pro Max XS XR 11 6 7 8 Glitter Bling Diamonds Case with Plush Ball 12.85 USD Free shipping For iPhone 12 11 Pro XS Max XR 7 8 Bling Glitter Diamond Mirror Laser Case Cover 9.59 USD Free shipping Bling Diamond Crystal Ring Holder Case for iPhone 12 Pro Max 11 Pro XS XR 6 7 8 10.85 USD Free shipping For iPhone 12 Pro Max 11 Pro XS XR 6 7 8 Luxury Bling Diamond Crystal Ring Case 10.85 USD Free shipping Bling Glitter Flowers Square Case w/ Ring For iPhone 12 11 Pro XS Max XR 6 7 8 10.99 USD Free shipping For iPhone 12 11 Pro Max XR 6 7 8 Bling Glitter Mirror Diamond Ring Holder Case 9.85 USD Free shipping For iPhone 12 11 Pro XS Max XR 7 8 6 Bling Diamond Rhinestone Mirror Holder Case 10.85 USD Free shipping For iPhone 12 Pro Max 11 XR 67 8 Women Fashion Flowers Leather Wallet Case Cover 12.58 USD Free shipping Bling Glitter Butterfly Diamond Plush Ball Case For iPhone 12 11 Pro X Max XR 78 10.98 USD Free shipping For iPhone 12 11 Pro Max XS XR 6 7 8 Bling Glitter Diamond Flowers Case Cover 9.85 USD Free shipping For iPhone 12 Pro Max 11 XS XR 8 7 Luxury Retro Square Marble Glitter Case Cover 9.99 USD Free shipping",https://www.ebay.com/itm/For-iPhone-12-Pro-Max-11-XS-Max-XR-6-7-8-Epoxy-Glitter-Sparkle-Bling-Case-Cover/124468393517?var=425341190997?,7.99, FREE ,"South El Monte, California, United States"
12,For iPhone 12 11 Pro Max XS XR 6 7 8 Glitter Marble Butterfly Diamond Case Cover," For iPhone 12 Pro Max 11 XS XR 6 7 8 Glitter Bling  Mirror Diamond Case w/ Ring 9.99 USD Free shipping For iPhone 12 11 Pro XS Max XR 7 8 6 Bling Diamond Rhinestone Ring Holder Case 10.99 USD Free shipping For iPhone 12 Pro Max 11 XS XR 6 7 8 Bling Glitter Diamond Flowers Case Cover 9.99 USD Free shipping Bling Diamond Rhinestone Ring Holder Case for iPhone 12 Pro Max 11 XS XR 6 7 8 10.85 USD Free shipping Bling Glitter Luxury Metal Square Case Cover For iPhone 12 11 Pro XS Max XR 7 8 9.99 USD Free shipping For iPhone 12 Pro Max 11 XS XR 7 8 Bling Sparkle Glitter Diamond Rhinestone Case 9.99 USD Free shipping For iPhone 12 11 Pro Max XS XR 7 8 Epoxy Glitter Sparkle Side Diamond Case Cover 9.95 USD Free shipping For iPhone 12 11 Pro Xs MAX XR 7 8 Epoxy Glitter Sparkle Side Diamond Case Cover 10.59 USD Free shipping Glitter Bling Luxury Snake Diamond Phone Case for iPhone 12 11 Pro Max XS XR 7 8 13.95 USD Free shipping For iPhone 12 11 Pro XS Max XR 7 8 6 Bling Diamond Rhinestone Mirror Holder Case 10.85 USD Free shipping For iPhone 11 12 Pro Max XS XR 8 Bling Sparkle Diamond Perfume Bottle Case Cover 14.38 USD Free shipping For iPhone 12 11 Pro Max XS XR 7 8 Luxury Marble Flower Metal Square Case Cover 10.99 USD Free shipping For iPhone 12 Pro Max 11 XS XR 8 7 Luxury Retro Square Marble Glitter Case Cover 9.99 USD Free shipping For iPhone 12 11 Pro Max XS XR 6 7 8 Bling Diamond Ring Crystal Chain Case Cover 10.95 USD Free shipping Luxury Bling Diamond Phone Case Cover for iPhone 12 Pro Max 11 Pro XS XR 8 7 6 9.99 USD Free shipping For iPhone 12 11 Pro Max XS XR 8 7 6 Bling Sparkle Diamond Gradient Case Cover 9.69 USD Free shipping For iPhone 12 11 Pro Max XS XR 6 7 8 Luxury Retro Marble Metal Square Case Cover 10.99 USD Free shipping For iPhone 12 11 Pro Max XS XR 6 7 8 Girls Women Bling Diamond w/Ring Case Cover 9.99 USD Free shipping Product Description Feature: 1.Design to fit your phone perfectly! 2.Bling Bling style, make you and your phone look charming and fashionable. 3.High-quality TPU inner frame maximum protects your phone from drop and scratch protection. 4.Precise cut easy access to all ports, sensors, speakers, cameras and all features. 5.Fashionable, unique, striking, great for party or everyday use. Package Include: 1 * Phone Case Please Note: Pictures  are only for style display,delivery will beaccording to the phone  model you choose,don't worry about the wrong hole position. Compatibility: Apple  iPhone 6/6S, iPhone6/6S Plus, iPhone 7/8, iPhone 7/8 Plus, iPhone X/XS,  iPhone XR, iPhone XS Max, iPhone 11, iPhone 11 Pro, iPhone 11 Pro Max, iPhone 12 Mini, iPhone 12/12 Pro, iPhone 12 Pro Max Payment Shipping Return Feedback Contact us 1. Pay secure with any major credit card through PayPal. 2. For International buyers, Import duties, tax and charges are not included in the item price or shipping charge. powered by For iPhone 12 11 Pro Max XS XR 7 8 6 Bling Glitter Crossbody Case Leather Wallet 12.58 USD Free shipping For iPhone 12 11 Pro XS Max XR 7 8 Bling Diamond  Rhinestone Wallet Leather Case 11.99 USD Free shipping For iPhone 12 Pro Max 11 XS XR 6 7 8 Glitter Bling Diamond Mirror w/ Ring Case 9.85 USD Free shipping For iPhone 12 Pro Max 11 XS XR 7 8 Glitter Diamond Butterfly Case w/ Ring&Strap 10.85 USD Free shipping For iPhone 12 Pro Max 11 XS XR 6 7 8 Glitter Diamond Mirror w/ Ring Holder Case 10.99 USD Free shipping For iPhone 12 Pro Max 11 XS XR 7 8 Glitter Sparkle Diamond Case Cover with Ring 9.99 USD Free shipping Bling Diamond Side Rhinestone Clear Case For iPhone 12 Pro Max 11 XS XR 6 7 8 9.99 USD Free shipping For iPhone 12 Pro Max XS XR 11 6 7 8 Glitter Bling Diamonds Case with Plush Ball 12.85 USD Free shipping For iPhone 12 11 Pro XS Max XR 7 8 Bling Glitter Diamond Mirror Laser Case Cover 9.59 USD Free shipping Bling Diamond Crystal Ring Holder Case for iPhone 12 Pro Max 11 Pro XS XR 6 7 8 10.85 USD Free shipping For iPhone 12 Pro Max 11 Pro XS XR 6 7 8 Luxury Bling Diamond Crystal Ring Case 10.85 USD Free shipping Bling Glitter Flowers Square Case w/ Ring For iPhone 12 11 Pro XS Max XR 6 7 8 10.99 USD Free shipping For iPhone 12 11 Pro Max XR 6 7 8 Bling Glitter Mirror Diamond Ring Holder Case 9.85 USD Free shipping For iPhone 12 11 Pro XS Max XR 7 8 6 Bling Diamond Rhinestone Mirror Holder Case 10.85 USD Free shipping For iPhone 12 Pro Max 11 XR 67 8 Women Fashion Flowers Leather Wallet Case Cover 12.58 USD Free shipping Bling Glitter Butterfly Diamond Plush Ball Case For iPhone 12 11 Pro X Max XR 78 10.98 USD Free shipping For iPhone 12 11 Pro Max XS XR 6 7 8 Bling Glitter Diamond Flowers Case Cover 9.85 USD Free shipping For iPhone 12 Pro Max 11 XS XR 8 7 Luxury Retro Square Marble Glitter Case Cover 9.99 USD Free shipping",https://www.ebay.com/itm/For-iPhone-12-11-Pro-Max-XS-XR-6-7-8-Glitter-Marble-Butterfly-Diamond-Case-Cover/124395678371?var=425268395692?,7.99, FREE ,"South El Monte, California, United States"
13,Led Qi Wireless Charger Fast Charge Pad For Samsung iPhone XS Max X XR 11 12 Pro," Specifications: Product standard: Qi standard Material: ABS+rubb Chargingpower:10W/7.5W/5W Input voltage/current: 5V-2A/9V-2A Charging distance: ≤8mm Product certification: CE/FCC/Rosh Gross weight: 150g Charging efficiency: ≥73% ​ ​ WARNING: 1.AC adapter not included, please confirm your devices is Qi standard. 2. Make sure get your device lined up correctly (Sweet Spot), Or "" Incompatible Device"" maybe show on your phone, Or you cannot charge your Phone consistently. Customers Attention : 1.If any questions or need, please feel free and contact us directly ,we will help to solve your problems within 24 hours . 2.Follow our store and be our FANS you will get more extra discount and enjoy the VIP service. 3.Thank you very much for your understanding and attention . Wish you will enjoy the shopping in our store. ​",https://www.ebay.com/itm/Led-Qi-Wireless-Charger-Fast-Charge-Pad-For-Samsung-iPhone-XS-Max-X-XR-11-12-Pro/313241072342?var=612086526999?,10.89/ea, FREE ,"Brooklyn, New York, United States"
14,LED Fast Charging USB Charger Cable For iPhone 12/11 + Pro/XS Max/XR/X/8/7 8 PIN," LED Fast Charging USB Charger Cable For iPhone 12/11 + Pro/XS Max/XR/X/8/7 8 PIN LED Flowing changing light USB Cable Mobile Phone Charging Cable Visibly flowing and bright LEDs , looks beautiful . The flowing light makes the electric current visible, which makes it a perfect decoration in the room, office or car. Length : 3 FT / 1M Compatibility : COMPATIBLE WITHANY 8 PIN(apple port) Extra Information: Bring back the original brand new look! This is a NEW part. This item is BRAND NEW! Save MONEY and your PHONE by using the best replacement part available. This Assembly ships with a protective foam wrap, along with a protective plastic to prevent any scratches. This item is very carefully packaged Payment Information: We Accept PayPal We Accept Credit Card via PayPal Shipping Information: We provide Same Day FREE SHIPPING domestically within the U.S.A USPS First Class (3-5 business days) & USPS First-Class International (14 days with tracking) (We do ship to APO/FPO) We reserve the right to charge additional shipping fee for reship items due to wrong shipping address provided during checkout. All orders before 5PM EST will ship out same day!, Monday - Friday Ships Same Day Today! Refund & Return Policy: We offer a 30 day return policy on all items purchased from us. Please contact us within 30 days after receipt of the item for a return. Do not ship the item back to us without contacting us first. Return shipping is responsibility of buyer. - We thank you so much for looking! If you have any questions or concerns, please do not hesitate to message us. Have a great day!",https://www.ebay.com/itm/LED-Fast-Charging-USB-Charger-Cable-For-iPhone-12-11-Pro-XS-Max-XR-X-8-7-8-PIN/202826530691?var=502995960058?,5.89/ea, FREE ,"North Hollywood, California, United States"
15,For iPhone 12 11 Pro Max XR XS 7 8 + Slim TPU Leather Square Metal Corner Cover," Slim TPU Leather Square Metal Corner Cover For iPhone 12/12 Pro  6.1inch, For iPhone 12 Pro Max 6.7inch, For  iPhone 12 mini 5.4inch, For  iPhone 11 Pro Max, For iPhone 11 Pro, For  iPhone 11, For iPhone XS  Max, For iPhone XR, For iPhone X/XS, For iPhone  7/8 Plus, For iPhone  7/8 The soft TPU material can perfectly fit. Makes your phone look more fashionable and cute. The protective case is easy to install and remove, and supports wireless charging. Protects your device from bumps, scratches & fingerprint. Fit for iPhone. Please Note: For our handmade products please allow 1/2-1 inch deviation from sizes in the size chart if this product has one. Due to the difference between different monitors, the picture may not reflect the actual color of the item. We guarantee the style is the same as shown in the pictures. Please note the all items in your orders will be shipped within 1-2 business days after we receive payment. You will receive a tracking number for your package through our shipping partner. And the shipping usually takes 2-8 business days to arrive depending on your location. We ship from Los Angeles, CA. If we do not receive payment, an Unpaid Item Dispute case will AUTOMATICALLY be opened. Returns & Exchanges: Exchanges or refunds will be allowed within 30 days after you receive the package. Please contact us as soon as possible when you want to exchange or return the item. Please note the item must be new and never used. We will not honor any returns for items that is already used. We will be glad to resolve any issue. Contact Us if you have any questions, we will try our best to answer it within 24 hours.",https://www.ebay.com/itm/For-iPhone-12-11-Pro-Max-XR-XS-7-8-Slim-TPU-Leather-Square-Metal-Corner-Cover/402530203171?var=672850677940?,10.99/ea, FREE ,"El Monte, California, United States"
